<?xml version="1.0" encoding="UTF-8"?>
<zen:movies xmlns:xsi="http://www.w3.org/2001/XMLSchema-instance" xmlns:zen="http://www.zensar.com/Movies" xsi:schemaLocation="http://www.zensar.com/Movies movies.xsd ">
  <zen:movie>
    <zen:code>5231</zen:code>
    <zen:title>aao dekhe</zen:title>
        <zen:release-date>2019-08-15</zen:release-date>
    	 <zen:theater-name>inox</zen:theater-name>
   </zen:movie>
   
    <zen:movie>
    <zen:code>5009</zen:code>
    <zen:title>vghikjk</zen:title>
        <zen:release-date>2000-01-15</zen:release-date>
    	 <zen:theater-name>inox</zen:theater-name>
    
  </zen:movie>
</zen:movies>
